<?xml version="1.0" encoding="UTF-8"?>
<NFV xmlns:xsi="http://www.w3.org/2001/XMLSchema-instance" xsi:noNamespaceSchemaLocation="../xsd/nfvSchema.xsd">
  <graphs>
    <graph id="0">
     <node functional_type="WEBCLIENT" name="nodeA">
        <neighbour name="node1"/>
        <configuration description="A simple description" name="confA">
          <webclient nameWebServer="nodeB"/>
        </configuration>
      </node>
      <node functional_type="FIREWALL" name="node1">
        <neighbour name="nodeA"/>
        <neighbour name="node2"/>
        <configuration description="A simple description" name="conf1">
          <firewall>
            <elements>
              <source>nodeC</source>
              <destination>nodeD</destination>
            </elements>
          </firewall>
        </configuration>
      </node>
      <node functional_type="DPI" name="node2">
        <neighbour name="node1"/>
        <neighbour name="node3"/>
        <configuration description="A simple description" name="conf2">
          <dpi>
          	<notAllowed>nodeC</notAllowed>
          </dpi>
        </configuration>
      </node>
      <node functional_type="CACHE" name="node3">
        <neighbour name="node2"/>
        <neighbour name="node4"/>
        <configuration description="A simple description" name="conf3">
          <cache>
          	<resource>nodeA</resource>
          	<resource>node1</resource>
          	<resource>node2</resource>
          </cache>
        </configuration>
      </node>
	  <node functional_type="NAT" name="node4">
        <neighbour name="node3"/>
        <neighbour name="nodeB"/>
        <configuration description="A simple description" name="conf4">
         <nat>
          		<source>nodeA</source>
          		<source>node1</source>
          		<source>node2</source>
          		<source>node3</source>
          </nat>
        </configuration>
      </node>
   
      <node functional_type="WEBSERVER" name="nodeB">
        <neighbour name="node4"/>
        <configuration description="A simple description" name="confB">
          <webserver>
          	<name>nodeB</name>
          </webserver>
        </configuration>
      </node>
    </graph>
  </graphs>
  <Constraints>
	  <NodeConstraints>
			<NodeMetrics node="node1" reqStorage="38"/>
			<NodeMetrics node="node2" reqStorage="20"/>
			<NodeMetrics node="node3" reqStorage="50"/>
			<NodeMetrics node="node4" reqStorage="38"/>
	  </NodeConstraints>
	  <LinkConstraints/>
  </Constraints>
  <PropertyDefinition>
  		<Property graph="0" name="ReachabilityProperty" src="nodeA" dst="nodeB"/> 		
  </PropertyDefinition>
  <Hosts>
        <Host name="e050caaa" cpu="2" cores="2" memory="4" fixedEndpoint="nodeA" diskStorage="137" type="CLIENT"/>
        <Host name="5a01b700" cpu="4" cores="4" memory="16" maxVNF="4"  diskStorage="122" type="MIDDLEBOX">
			<SupportedVNF functional_type="FIREWALL"/>
			<SupportedVNF functional_type="CACHE"/>
			<SupportedVNF functional_type="ANTISPAM"/>
			<SupportedVNF functional_type="DPI"/>
			<SupportedVNF functional_type="NAT"/>
			<SupportedVNF functional_type="FIELDMODIFIER"/>
		</Host>
        <Host name="5a01b6ff" cpu="4" cores="4" memory="16" maxVNF="4" diskStorage="148" type="MIDDLEBOX">
			<SupportedVNF functional_type="FIREWALL"/>
			<SupportedVNF functional_type="CACHE"/>
			<SupportedVNF functional_type="ANTISPAM"/>
			<SupportedVNF functional_type="DPI"/>
			<SupportedVNF functional_type="NAT"/>
			<SupportedVNF functional_type="FIELDMODIFIER"/>
		</Host>
        <Host name="c0286ecd" cpu="4" cores="4" memory="16" maxVNF="4" diskStorage="106" type="MIDDLEBOX">
			<SupportedVNF functional_type="FIREWALL"/>
			<SupportedVNF functional_type="CACHE"/>
			<SupportedVNF functional_type="ANTISPAM"/>
			<SupportedVNF functional_type="DPI"/>
			<SupportedVNF functional_type="NAT"/>
			<SupportedVNF functional_type="FIELDMODIFIER"/>
		</Host>
        <Host name="c0286ece" cpu="4" cores="4" memory="16" maxVNF="4" diskStorage="147" type="MIDDLEBOX">
			<SupportedVNF functional_type="FIREWALL"/>
			<SupportedVNF functional_type="CACHE"/>
			<SupportedVNF functional_type="ANTISPAM"/>
			<SupportedVNF functional_type="DPI"/>
			<SupportedVNF functional_type="NAT"/>
			<SupportedVNF functional_type="FIELDMODIFIER"/>
		</Host>
        <Host name="e050ca8c" cpu="4" cores="4" memory="16" maxVNF="4" diskStorage="127" type="MIDDLEBOX">
			<SupportedVNF functional_type="FIREWALL"/>
			<SupportedVNF functional_type="CACHE"/>
			<SupportedVNF functional_type="ANTISPAM"/>
			<SupportedVNF functional_type="DPI"/>
			<SupportedVNF functional_type="NAT"/>
			<SupportedVNF functional_type="FIELDMODIFIER"/>
		</Host>
        <Host name="5a01b706" cpu="4" cores="4" memory="16" maxVNF="4" diskStorage="142" type="MIDDLEBOX">
			<SupportedVNF functional_type="FIREWALL"/>
			<SupportedVNF functional_type="CACHE"/>
			<SupportedVNF functional_type="ANTISPAM"/>
			<SupportedVNF functional_type="DPI"/>
			<SupportedVNF functional_type="NAT"/>
			<SupportedVNF functional_type="FIELDMODIFIER"/>
		</Host>
        <Host name="6f3cda8c" cpu="4" cores="4" memory="16" maxVNF="4" diskStorage="125" type="MIDDLEBOX">
			<SupportedVNF functional_type="FIREWALL"/>
			<SupportedVNF functional_type="CACHE"/>
			<SupportedVNF functional_type="ANTISPAM"/>
			<SupportedVNF functional_type="DPI"/>
			<SupportedVNF functional_type="NAT"/>
			<SupportedVNF functional_type="FIELDMODIFIER"/>
		</Host>
        <Host name="8951021b" cpu="4" cores="4" memory="16" maxVNF="4" diskStorage="143" type="MIDDLEBOX">
			<SupportedVNF functional_type="FIREWALL"/>
			<SupportedVNF functional_type="CACHE"/>
			<SupportedVNF functional_type="ANTISPAM"/>
			<SupportedVNF functional_type="DPI"/>
			<SupportedVNF functional_type="NAT"/>
			<SupportedVNF functional_type="FIELDMODIFIER"/>
		</Host>
        <Host name="fe24ec49" cpu="4" cores="4" memory="16" maxVNF="4" diskStorage="102" type="MIDDLEBOX">
			<SupportedVNF functional_type="FIREWALL"/>
			<SupportedVNF functional_type="CACHE"/>
			<SupportedVNF functional_type="ANTISPAM"/>
			<SupportedVNF functional_type="DPI"/>
			<SupportedVNF functional_type="NAT"/>
			<SupportedVNF functional_type="FIELDMODIFIER"/>
		</Host>
        <Host name="8951021c" cpu="4" cores="4" memory="16" maxVNF="4" diskStorage="127" type="MIDDLEBOX">
			<SupportedVNF functional_type="FIREWALL"/>
			<SupportedVNF functional_type="CACHE"/>
			<SupportedVNF functional_type="ANTISPAM"/>
			<SupportedVNF functional_type="DPI"/>
			<SupportedVNF functional_type="NAT"/>
			<SupportedVNF functional_type="FIELDMODIFIER"/>
		</Host>
        <Host name="e050ca8d" cpu="4" cores="4" memory="16" maxVNF="4" diskStorage="113" type="MIDDLEBOX">
			<SupportedVNF functional_type="FIREWALL"/>
			<SupportedVNF functional_type="CACHE"/>
			<SupportedVNF functional_type="ANTISPAM"/>
			<SupportedVNF functional_type="DPI"/>
			<SupportedVNF functional_type="NAT"/>
			<SupportedVNF functional_type="FIELDMODIFIER"/>
		</Host>
        <Host name="65d5058" cpu="4" cores="4" memory="16" maxVNF="4" diskStorage="110" type="MIDDLEBOX">
			<SupportedVNF functional_type="FIREWALL"/>
			<SupportedVNF functional_type="CACHE"/>
			<SupportedVNF functional_type="ANTISPAM"/>
			<SupportedVNF functional_type="DPI"/>
			<SupportedVNF functional_type="NAT"/>
			<SupportedVNF functional_type="FIELDMODIFIER"/>
		</Host>
        <Host name="65ade8e6" cpu="4" cores="4" memory="16" maxVNF="4" diskStorage="142" type="MIDDLEBOX">
			<SupportedVNF functional_type="FIREWALL"/>
			<SupportedVNF functional_type="CACHE"/>
			<SupportedVNF functional_type="ANTISPAM"/>
			<SupportedVNF functional_type="DPI"/>
			<SupportedVNF functional_type="NAT"/>
			<SupportedVNF functional_type="FIELDMODIFIER"/>
		</Host>
        <Host name="65d5057" cpu="4" cores="4" memory="16" maxVNF="4" diskStorage="133" type="MIDDLEBOX">
			<SupportedVNF functional_type="FIREWALL"/>
			<SupportedVNF functional_type="CACHE"/>
			<SupportedVNF functional_type="ANTISPAM"/>
			<SupportedVNF functional_type="DPI"/>
			<SupportedVNF functional_type="NAT"/>
			<SupportedVNF functional_type="FIELDMODIFIER"/>
		</Host>
        <Host name="65ade8e5" cpu="4" cores="4" memory="16" maxVNF="4" diskStorage="133" type="MIDDLEBOX">
			<SupportedVNF functional_type="FIREWALL"/>
			<SupportedVNF functional_type="CACHE"/>
			<SupportedVNF functional_type="ANTISPAM"/>
			<SupportedVNF functional_type="DPI"/>
			<SupportedVNF functional_type="NAT"/>
			<SupportedVNF functional_type="FIELDMODIFIER"/>
		</Host>
        <Host name="6f3cda68" cpu="4" cores="4" memory="16" maxVNF="4" diskStorage="147" type="MIDDLEBOX">
			<SupportedVNF functional_type="FIREWALL"/>
			<SupportedVNF functional_type="CACHE"/>
			<SupportedVNF functional_type="ANTISPAM"/>
			<SupportedVNF functional_type="DPI"/>
			<SupportedVNF functional_type="NAT"/>
			<SupportedVNF functional_type="FIELDMODIFIER"/>
		</Host>
        <Host name="c02871d5" cpu="4" cores="4" memory="16" maxVNF="4" diskStorage="136" type="MIDDLEBOX">
			<SupportedVNF functional_type="FIREWALL"/>
			<SupportedVNF functional_type="CACHE"/>
			<SupportedVNF functional_type="ANTISPAM"/>
			<SupportedVNF functional_type="DPI"/>
			<SupportedVNF functional_type="NAT"/>
			<SupportedVNF functional_type="FIELDMODIFIER"/>
		</Host>
        <Host name="e489dbc1" cpu="4" cores="4" memory="16" maxVNF="4" diskStorage="123" type="MIDDLEBOX">
			<SupportedVNF functional_type="FIREWALL"/>
			<SupportedVNF functional_type="CACHE"/>
			<SupportedVNF functional_type="ANTISPAM"/>
			<SupportedVNF functional_type="DPI"/>
			<SupportedVNF functional_type="NAT"/>
			<SupportedVNF functional_type="FIELDMODIFIER"/>
		</Host>
        <Host name="2d720ca9" cpu="4" cores="4" memory="16" maxVNF="4" diskStorage="125" type="MIDDLEBOX">
			<SupportedVNF functional_type="FIREWALL"/>
			<SupportedVNF functional_type="CACHE"/>
			<SupportedVNF functional_type="ANTISPAM"/>
			<SupportedVNF functional_type="DPI"/>